{
  "schema_version": "1.0",
  "id": "ST-01",
  "name": "Unterzug Stahl",
  "label": "IPE 360 in S355, Biegung mit Normalkraft",
  "group": "",
  "kind": "bending",
  "position": null,
  "profile": {
    "type": "IPE",
    "dimension": "360"
  },
  "grade": "S355",
  "N": {
    "value": -300,
    "unit": "kN"
  },
  "M_y": {
    "value": 150,
    "unit": "kNm"
  },
  "M_z": {
    "value": 10,
    "unit": "kNm"
  }
}
